{
  "$schema": "https://json-schema.org/draft/2020-12/schema",
  "title": "ARPAPED Verification Record",
  "description": "Machine-readable record of the mandatory Verify phase. Written into the resulting state; the next cycle re-runs the harness and accepts no goal until the record is green.",
  "type": "object",
  "required": [
    "verification_id",
    "state_ref",
    "harness",
    "checks",
    "passed",
    "failed",
    "status"
  ],
  "properties": {
    "verification_id": {
      "type": "string"
    },
    "state_ref": {
      "type": "string"
    },
    "harness": {
      "type": "string",
      "description": "Path or identity of the verification harness in the resulting state."
    },
    "environment": {
      "type": "object",
      "description": "The platform this harness run actually executed on -- captured ONCE per verification run (constant for the whole run, never per-check, since the OS/arch/runtime don't change mid-run) so a platform-specific failure (e.g. a Windows-only pipe-buffering bug, observed for real) is diagnosable from the record alone, never requiring an after-the-fact 'what OS was this run on?'.",
      "required": ["os", "arch"],
      "properties": {
        "os": {
          "type": "string",
          "description": "e.g. 'Windows', 'Linux', 'Darwin' (Python's platform.system(), or the equivalent for whatever language the harness runs in)."
        },
        "os_release": {
          "type": "string"
        },
        "arch": {
          "type": "string",
          "description": "e.g. 'AMD64', 'x86_64' (platform.machine())."
        },
        "runtime": {
          "type": "string",
          "description": "e.g. 'CPython 3.9.6', 'Node 20.11.0' -- language-agnostic, whatever runtime actually executed this harness, never assumed to be Python."
        }
      }
    },
    "checks": {
      "type": "array",
      "items": {
        "type": "object",
        "required": ["check_id", "description", "status"],
        "properties": {
          "check_id": {
            "type": "string",
            "description": "Unique across the entire record so an audit can reference exactly one check."
          },
          "input": {
            "description": "The actual input this check's capability operation was called with -- what produced the recorded trace/selection/evidence/expected/actual. Any JSON type, matching whatever the operation's own contract-declared input shape is. Without this, a check's observations are unreproducible from the record alone: reconstructing 'what call produced this trace' would require re-reading the harness's own source rather than the record it wrote."
          },
          "description": {
            "type": "string"
          },
          "status": {
            "type": "string",
            "enum": ["passed", "failed"]
          },
          "check_type": {
            "type": "string",
            "enum": ["capability_operation", "invariant", "regression"],
            "description": "Optional classifier. When set to 'capability_operation', the check MUST carry an observed 'trace' (see the conditional below) equal to the Bridge's own response.trace."
          },
          "observed": {
            "type": ["string", "null"],
            "description": "Observed evidence (state, counts, message). Always present for failed checks; may also be recorded for passed checks."
          },
          "trace": {
            "type": "array",
            "items": {
              "type": "string"
            },
            "description": "The OBSERVED full Bridge trace (the Bridge's own response.trace) for this capability operation, evaluated as validated -> discovered -> policy_evaluated -> selected -> executed. REQUIRED for every capability-operation check; must be copied from the Bridge, never constructed by the harness (R8, Gate 28).",
            "minItems": 1
          },
          "regression_for": {
            "type": "string",
            "description": "Previous defect id this check protects against, when applicable."
          },
          "expected": {
            "description": "The value this check asserted against, structured rather than interpolated into a string (contrast the older pattern of writing 'observed': \"expected X, got Y\"). Any JSON type -- a trace array, a response.output object, an implementation_id string, a scalar count. Present together with 'actual' or not at all (see dependentRequired below) -- 'observed' remains the right field for a check with no natural expected/actual split (e.g. contract/manifest schema validation)."
          },
          "actual": {
            "description": "The value actually observed for this check, structured the same way as 'expected'. A lone 'actual' with no stated 'expected' is not a comparison; a lone 'expected' proves nothing was actually observed -- both or neither."
          },
          "selection": {
            "type": "object",
            "description": "Bridge-level Decision Context for this check's capability operation -- distinct from the agent-level Phase-4 decisions[] in agent-cycle-report.schema.json (2-RULES.md glossary). Copied from the Bridge's own observed response.selection, never invented -- the same authenticity 'trace' already requires (R8, Gate 28/37).",
            "required": ["capability_id", "operation", "contract_version", "candidates", "selected", "reason"],
            "properties": {
              "capability_id": {"type": "string"},
              "operation": {"type": "string"},
              "contract_version": {"type": "string"},
              "candidates": {
                "type": "array",
                "minItems": 1,
                "items": {
                  "type": "object",
                  "required": ["implementation_id", "priority"],
                  "properties": {
                    "implementation_id": {"type": "string"},
                    "priority": {"type": "integer"}
                  }
                },
                "description": "Every candidate discovered AND policy-allowed for this request (the Bridge's own post-policy_evaluated, pre-selected list). A single-candidate array is honest and expected when only one implementation exists or is policy-allowed for this request -- it is not evidence of a bug."
              },
              "selected": {
                "type": "string",
                "description": "implementation_id that actually executed."
              },
              "reason": {
                "type": "string",
                "description": "Deterministic, honest wording, e.g. \"highest priority (200) among 2 policy-allowed candidates\", or, after a failover, \"priority 150 selected after widget.render.v2 failed over, among 2 policy-allowed candidates\". Never a vague 'best match'."
              }
            }
          },
          "evidence": {
            "type": "object",
            "description": "Process-kind (executor_kind: process) execution evidence -- populated only when the selected implementation ran out-of-process (R4 Worker). Absent for direct/factory/remote-kind operations: there is nothing analogous to capture for an in-process call sharing the Bridge's own stdout, or a Remote call whose own runtime already records its own genuine trace.",
            "required": ["executor_kind", "response_output"],
            "properties": {
              "executor_kind": {"type": "string", "const": "process"},
              "response_output": {
                "type": "object",
                "description": "The structured {'output': {...}} payload the worker actually returned over process-executor-protocol.schema.json for this call -- already produced in memory today, persisted here rather than discarded."
              },
              "stdout": {
                "type": "string",
                "description": "Raw bytes (UTF-8, errors='replace') the worker wrote to its own OS-level stdout during the span this invocation exclusively held its worker connection. Genuinely empty for an implementation whose responsibility never prints (e.g. one that only makes a nested Bridge call) and genuinely non-empty for one whose responsibility IS to print -- never assumed empty."
              },
              "stderr": {
                "type": "string",
                "description": "Same capture, for the worker's own stderr, over the same invocation span."
              },
              "worker_alive": {
                "type": "boolean",
                "description": "Whether the worker's TCP connection was still usable immediately after this call."
              },
              "process_exit_code": {
                "type": ["integer", "null"],
                "description": "A non-blocking Popen.poll() snapshot taken right after this call -- null while the pooled worker is still running (the normal case), an integer only if it had already exited/crashed. Not 'the' exit code of one request -- a pooled process outlives any single call."
              }
            }
          }
        },
        "dependentRequired": {
          "actual": ["expected"],
          "expected": ["actual"]
        },
        "allOf": [
          {
            "if": {
              "properties": {
                "check_type": {
                  "const": "capability_operation"
                }
              },
              "required": ["check_type"]
            },
            "then": {
              "required": ["trace"]
            }
          },
          {
            "if": {
              "required": ["evidence"]
            },
            "then": {
              "required": ["check_type"],
              "properties": {
                "check_type": {
                  "const": "capability_operation"
                }
              }
            }
          }
        ]
      }
    },
    "passed": {
      "type": "integer",
      "minimum": 0
    },
    "failed": {
      "type": "integer",
      "minimum": 0
    },
    "failures": {
      "type": "array",
      "items": {
        "type": "object",
        "properties": {
          "check_id": {
            "type": "string"
          },
          "observed": {
            "type": "string"
          }
        }
      }
    },
    "status": {
      "type": "string",
      "enum": ["verified", "failed"]
    },
    "lineage": {
      "type": "array",
      "items": {
        "type": "object"
      }
    }
  }
}