{
  "verification_id": "hello-world-72bece163aa8",
  "state_ref": "samples/hello_world",
  "harness": "samples/hello_world/tests/verify/verify.py",
  "checks": [
    {
      "check_id": "contract-valid:console.write.contract.yaml",
      "description": "console.write.contract.yaml validates against component-contract.schema.json",
      "status": "passed"
    },
    {
      "check_id": "contract-valid:greeting.compose.contract.yaml",
      "description": "greeting.compose.contract.yaml validates against component-contract.schema.json",
      "status": "passed"
    },
    {
      "check_id": "manifest-valid:capabilities/console/write/manifest.yaml",
      "description": "capabilities/console/write/manifest.yaml validates against capability-manifest.schema.json",
      "status": "passed"
    },
    {
      "check_id": "manifest-valid:capabilities/console/write_process/manifest.yaml",
      "description": "capabilities/console/write_process/manifest.yaml validates against capability-manifest.schema.json",
      "status": "passed"
    },
    {
      "check_id": "manifest-valid:capabilities/console/write_v2/manifest.yaml",
      "description": "capabilities/console/write_v2/manifest.yaml validates against capability-manifest.schema.json",
      "status": "passed"
    },
    {
      "check_id": "manifest-valid:capabilities/greeting/compose/manifest.yaml",
      "description": "capabilities/greeting/compose/manifest.yaml validates against capability-manifest.schema.json",
      "status": "passed"
    },
    {
      "check_id": "manifest-valid:capabilities/greeting/compose_process/manifest.yaml",
      "description": "capabilities/greeting/compose_process/manifest.yaml validates against capability-manifest.schema.json",
      "status": "passed"
    },
    {
      "check_id": "call:1:console_write",
      "description": "console_write.write (call 1) reaches every stage through console.write.v2",
      "status": "passed",
      "check_type": "capability_operation",
      "trace": [
        "validated",
        "discovered",
        "policy_evaluated",
        "selected",
        "executed"
      ]
    },
    {
      "check_id": "call:2:console_write",
      "description": "console_write.write (call 2) reaches every stage through console.write.v2",
      "status": "passed",
      "check_type": "capability_operation",
      "trace": [
        "validated",
        "discovered",
        "policy_evaluated",
        "selected",
        "executed"
      ]
    },
    {
      "check_id": "call:3:greeting_compose",
      "description": "greeting_compose.compose (call 3) reaches every stage through greeting.compose.default",
      "status": "passed",
      "check_type": "capability_operation",
      "trace": [
        "validated",
        "discovered",
        "policy_evaluated",
        "selected",
        "executed"
      ]
    },
    {
      "check_id": "call:4:console_write_legacy",
      "description": "console_write_legacy.write (call 4) reaches every stage through console.write.default",
      "status": "passed",
      "check_type": "capability_operation",
      "trace": [
        "validated",
        "discovered",
        "policy_evaluated",
        "selected",
        "executed"
      ]
    },
    {
      "check_id": "call:5:greeting_compose_process",
      "description": "greeting_compose_process.compose (call 5) reaches every stage through greeting.compose.process",
      "status": "passed",
      "check_type": "capability_operation",
      "trace": [
        "validated",
        "discovered",
        "policy_evaluated",
        "selected",
        "executed"
      ]
    },
    {
      "check_id": "call:6:console_write_process",
      "description": "console_write_process.write (call 6) reaches every stage through console.write.process",
      "status": "passed",
      "check_type": "capability_operation",
      "trace": [
        "validated",
        "discovered",
        "policy_evaluated",
        "selected",
        "executed"
      ]
    }
  ],
  "passed": 13,
  "failed": 0,
  "status": "verified"
}